cluster,working_label,coherence_manual,theme_family,include_in_sentiment,include_in_impact_brief,notes,size,share_pct
0,"EU AI Act, Compliance & Sovereign European AI",strong,policy_regulation,True,True,"Clear regulatory/compliance cluster centered on the EU AI Act, high-risk systems, documentation, and sovereign European AI infrastructure.",75,2.059308072487644
1,Off-topic Political Controversy / Retrieval Noise,noisy,noise_offtopic,False,False,Mixed political and celebrity discourse unrelated to AI safety/ethics. Likely retrieval contamination.,72,1.9769357495881383
2,"Military AI, Pentagon Pressure & Safety Guardrails",strong,military_security,True,True,"Defense/military use of AI, Anthropic–Pentagon conflict, surveillance, weapons, and safety red lines.",144,3.9538714991762767
3,"AI Markets, Investment Narratives & Data Center Economics",mixed,business_markets,True,False,"Economic and investor discourse around AI growth, capex, data centers, and markets; somewhat noisy.",363,9.967051070840197
4,OpenAI vs Anthropic Safety Debate,strong,lab_politics_trust,True,True,"Corporate AI safety rhetoric and rivalry between major labs, especially OpenAI and Anthropic.",96,2.6359143327841847
5,French / Off-topic Personal-Life Cluster (Retrieval Noise),noisy,noise_offtopic,False,False,Language-based grouping plus personal-life/confessional Reddit spillover; not a meaningful AI topic.,244,6.699615595826469
6,"AI SaaS Monetization, Pricing & Commercial Adoption",mixed,business_markets,False,False,"SaaS pricing, billing, subscriptions, AI agents in workflows, and monetization narratives.",55,1.5101592531576058
7,Claude / Coding Tools Mixed with False-Positive Tech Support Noise,noisy,noise_offtopic,False,False,Mix of Claude/coding discussion and obvious generic tech-support false positives.,57,1.5650741350906094
8,"OpenAI / GPT-4o Backlash, User Trust & Safety Complaints",strong,lab_politics_trust,True,True,"User backlash against OpenAI and GPT-4o: safety restrictions, deprecation, censorship, broken trust.",143,3.9264140582097746
9,"AI Job Replacement, Automation Anxiety & Labour Futures",strong,labour_jobs,True,True,"Clear labour-impact discourse about AI replacing jobs, automation anxiety, and future-of-work arguments.",280,7.688083470620538
10,"AI-Generated Image Detection, Authenticity & Scam Suspicion",mixed,authenticity_platforms,True,False,"Visual authenticity cluster: 'is this AI?', fake images, scams, Fiverr art, image trust issues.",68,1.8671059857221308
11,"AI Art Ethics, Artist Backlash & Creative Displacement",strong,creative_labour,True,True,"AI art as a moral and cultural flashpoint: artist identity, tracing, fairness, and creator displacement.",51,1.400329489291598
12,"Botified Platforms, AI Accounts & Synthetic Content Spam",strong,authenticity_platforms,True,True,"AI-generated posting, bot-like accounts, dead-user posting, fake growth, and slop-filled platforms.",73,2.0043931905546404
13,"India AI Policy, Summit Narratives & National Progress Discourse",mixed,regional_policy_progress,False,False,India-specific summit and policy/progress discourse; interpretable but somewhat contaminated.,130,3.5694673256452503
14,"State-Level AI Regulation, Child Safety & AI Personhood Debates",strong,policy_regulation,True,True,"State legislation, child safety plans, oversight units, election AI rules, and AI personhood debates.",68,1.8671059857221308
15,Enterprise AI Infrastructure & Regulated-Industry Adoption,mixed,business_markets,False,False,"Enterprise AI rollouts and partnerships in legal, finance, healthcare, telecom; largely institutional/promotional.",76,2.086765513454146
16,"LLM Safety, Evaluation, Jailbreaks & Technical Red-Teaming",mixed,technical_safety,True,True,"Technical cluster around jailbreaks, RAG, evals, prompting, and failure diagnosis; some contamination.",62,1.7023613399231192
17,"AI-Era Job Search, Resumes & Hiring Friction",mixed,labour_jobs,True,False,"Job hunting under AI conditions: resumes, interviews, ML/AI roles, remote work, and employability anxiety.",218,5.985722130697419
18,Anthropic Safety Retrenchment & Alignment Credibility,strong,lab_politics_trust,True,True,"Anthropic's weakened safety commitments, alignment credibility, and trust in self-described safety-first labs.",77,2.114222954420648
19,"AI Companionship, Personhood & Human-AI Emotional Ethics",mixed,philosophy_personhood,True,False,"AI companionship, emotional attachment, subjecthood/personhood, and what counts as 'AI done right'.",58,1.5925315760571115
20,"AI Regulation in Schools, Academic Use & Social Harm",mixed,education_governance,True,True,"School policies, student AI use, academic integrity, and broader harms like scams, deepfakes, and child risk.",98,2.6908292147171884
21,Ethical AI Debate & Normative Anti-AI Discourse,mixed,normative_ethics,True,False,"Normative debate about whether ethical AI is possible, where moral lines should be drawn, and anti-AI polemics.",99,2.7182866556836904
22,Red Team / Team Red False-Positive Sports Noise,noisy,noise_offtopic,False,False,Retrieval artefact caused by the query term 'red teaming' matching sports/gaming literal 'red team' content.,73,2.0043931905546404
23,General Entertainment / Fandom Chatter (Retrieval Noise),noisy,noise_offtopic,False,False,Large but incoherent entertainment/fandom/general Reddit chatter cluster; not meaningful AI discourse.,352,9.665019220208675
24,Philosophical / Metaphysical AI Consciousness & Cognitive Theory,mixed,philosophy_personhood,False,False,"Philosophical and quasi-metaphysical discourse about consciousness, cognition, and biological vs artificial intelligence.",72,1.9769357495881383
25,"AI Alignment, Control Problems & Human-Compatible AGI",mixed,technical_safety,True,False,"Alignment/control-problem discourse: human-compatible AI, shutdown resistance, safety datasets, and AGI control.",58,1.5925315760571115
26,"AI Agents, Workflow Automation & Operational Risk",strong,technical_safety,True,True,"AI agents in real workflows: automation, tooling, prompt-injection concerns, agent security, and deployment risk.",365,10.0219659527732
27,"Prompt Injection, Guardrails & Agent Security",strong,technical_safety,True,True,"Technical safety/security cluster focused on prompt injection, guardrails, MCP/tool use, and agent security.",115,3.1576057111477205
